{
  "schema_version": 1,
  "ontology_version": "reusable-pieces-v1",
  "profile": "commander_review",
  "classes": [
    {"id": "players_format", "label": "Players, relationships, and format state"},
    {"id": "object_identity", "label": "Object identity and lifetime"},
    {"id": "characteristics", "label": "Characteristics"},
    {"id": "references", "label": "References"},
    {"id": "quantities", "label": "Quantity and value expressions"},
    {"id": "predicates", "label": "Predicates and selectors"},
    {"id": "actions_permissions", "label": "Actions, permissions, and prohibitions"},
    {"id": "proposals", "label": "Casting and activation proposals"},
    {"id": "costs_mana", "label": "Costs and mana"},
    {"id": "choices_continuations", "label": "Modes, targets, choices, and continuations"},
    {"id": "stack_resolution", "label": "Stack and resolution"},
    {"id": "events_mutations", "label": "Typed events and mutations"},
    {"id": "one_shot_effects", "label": "One-shot semantic effects"},
    {"id": "replacement_prevention", "label": "Replacement and prevention"},
    {"id": "triggers", "label": "Triggers"},
    {"id": "continuous_effects", "label": "Static abilities and continuous effects"},
    {"id": "stabilization_turns", "label": "State-based, turn-based, loop, and shortcut pieces"},
    {"id": "combat", "label": "Combat"},
    {"id": "card_forms", "label": "Card types and specialized forms"},
    {"id": "multiplayer_commander", "label": "Multiplayer, Commander, and profile pieces"},
    {"id": "keyword_mechanics", "label": "Keyword actions and keyword abilities"},
    {"id": "compiler_cardprogram", "label": "Compiler and CardProgram pieces"},
    {"id": "interaction_assurance", "label": "Interaction and assurance pieces"}
  ],
  "relation_types": [
    "intrinsically_consumes",
    "produces",
    "observes",
    "modifies",
    "grants",
    "removes",
    "replaces",
    "prevents",
    "redirects",
    "copies",
    "links",
    "derives",
    "requires_profile_support"
  ],
  "status_axes": {
    "inventory": ["absent", "inventoried"],
    "compiler": ["unrecognized", "segmented", "parsed", "bound", "typed", "lowered", "validated"],
    "runtime": ["absent", "represented", "compositional", "foundation_trusted", "snapshot_complete"],
    "assurance": ["untested", "tested", "interaction_tested", "trusted"],
    "corpus": ["unused", "exact_ability_use", "residual_use", "mixed"],
    "interaction": ["unknown", "pairwise_covered", "high_risk_covered", "snapshot_complete"]
  },
  "residual_family_classes": {
    "capability_dependency": "actions_permissions",
    "mechanic_dependency": "keyword_mechanics",
    "keyword_dependency": "keyword_mechanics",
    "event_binding": "triggers",
    "effect_clause": "one_shot_effects",
    "static_clause": "continuous_effects",
    "activated_cost": "costs_mana",
    "activated_effect": "one_shot_effects",
    "target_or_choice": "choices_continuations",
    "reference_binding": "references",
    "quantity_expression": "quantities",
    "duration": "continuous_effects",
    "zone_permission": "actions_permissions",
    "search": "choices_continuations",
    "zone_transition": "object_identity",
    "replacement": "replacement_prevention",
    "continuous_layer": "continuous_effects",
    "copy_or_face": "card_forms",
    "card_form": "card_forms",
    "multiplayer": "multiplayer_commander",
    "unsupported_profile": "players_format",
    "non_rules_governed": "players_format"
  },
  "capability_prefix_classes": [
    {"prefix": "activation.", "class_id": "proposals"},
    {"prefix": "attachment.", "class_id": "card_forms"},
    {"prefix": "combat.", "class_id": "combat"},
    {"prefix": "continuous.", "class_id": "continuous_effects"},
    {"prefix": "counter.", "class_id": "events_mutations"},
    {"prefix": "damage.", "class_id": "events_mutations"},
    {"prefix": "draw.", "class_id": "events_mutations"},
    {"prefix": "format.", "class_id": "multiplayer_commander"},
    {"prefix": "life.", "class_id": "events_mutations"},
    {"prefix": "mana.", "class_id": "costs_mana"},
    {"prefix": "permanent.", "class_id": "events_mutations"},
    {"prefix": "protection.", "class_id": "actions_permissions"},
    {"prefix": "target.", "class_id": "choices_continuations"},
    {"prefix": "timing.", "class_id": "actions_permissions"},
    {"prefix": "token.", "class_id": "events_mutations"},
    {"prefix": "variant.", "class_id": "players_format"},
    {"prefix": "zone.", "class_id": "object_identity"}
  ],
  "runtime_family_classes": [
    {"prefix": "ability.activated", "class_id": "proposals"},
    {"prefix": "ability.enchant", "class_id": "card_forms"},
    {"prefix": "ability.static", "class_id": "continuous_effects"},
    {"prefix": "continuous.", "class_id": "continuous_effects"},
    {"prefix": "effect.damage", "class_id": "events_mutations"},
    {"prefix": "effect.life", "class_id": "events_mutations"},
    {"prefix": "effect.zone", "class_id": "object_identity"},
    {"prefix": "permanent.tap", "class_id": "events_mutations"},
    {"prefix": "replacement.", "class_id": "replacement_prevention"},
    {"prefix": "trigger.", "class_id": "triggers"}
  ],
  "universal_system_classes": {
    "objects_identity_zones_faces_copies": ["object_identity", "card_forms"],
    "typed_transactions_events_mutations": ["events_mutations", "one_shot_effects"],
    "action_legality_casting_activation_costs_mana": ["actions_permissions", "proposals", "costs_mana"],
    "targets_modes_searches_references_choices": ["references", "quantities", "predicates", "choices_continuations"],
    "replacement_prevention": ["replacement_prevention"],
    "generic_triggers_stack_placement": ["triggers", "stack_resolution"],
    "derived_characteristics_static_layers": ["characteristics", "continuous_effects"],
    "state_turn_loops_stabilization": ["stabilization_turns"],
    "combat": ["combat"],
    "multiplayer_player_leaving_commander": ["players_format", "multiplayer_commander"]
  },
  "high_risk_class_pairs": [
    ["card_forms", "continuous_effects"],
    ["card_forms", "object_identity"],
    ["choices_continuations", "object_identity"],
    ["continuous_effects", "replacement_prevention"],
    ["costs_mana", "replacement_prevention"],
    ["events_mutations", "replacement_prevention"],
    ["multiplayer_commander", "object_identity"],
    ["replacement_prevention", "triggers"],
    ["stack_resolution", "triggers"]
  ],
  "complex_card_weights": {
    "distinct_piece": 3,
    "universal_system": 5,
    "material_ability": 4,
    "blocker": 2,
    "linked_reference": 8,
    "delayed_or_trigger": 7,
    "replacement": 9,
    "continuous_layer": 9,
    "copy_or_face": 9,
    "multiplayer": 7,
    "official_ruling": 2
  },
  "complex_card_sentinels": ["Animate Dead"]
}
